{
  "schemaVersion":"1.0","runId":123456789,"runUrl":"https://github.com/OXY7O/example-app-dotnet/actions/runs/123456789","sourceSha":"aaaaaaaaaaaaaaaaaaaaaaaaaaaaaaaaaaaaaaaa","workflowSha":"d0f9bb9394796a22409ec9029182bec542615adc","canonical":{"readiness":"ci-qualified","artifactCount":1,"artifactDigest":"sha256:placeholder"},"preview":{"conclusion":"observed","artifactCount":0},"deploymentAuthorized":false
}
